1gj2ga4,What's  your cloud setup? ,"For people who are running LLMs in a hosted environment and use them for some sort of service or job that also runs in the cloud what's your setup and why?

I normally use AWS for things but the GPU EC2 machines are hella expensive. 

I could use some of these LLM services that allow me to use whatever model I want I'll have latency between my app service on AWS and a GPU renting service. 

So for people who are both running apps and models in the cloud what does your network topography look like, what are you hosting, what's the load to your service, what's the cost, and why did you pick this setup? 

",2024-11-03 17:04:32,1,https://www.reddit.com/r/LocalLLaMA/comments/1gj2ga4/whats_your_cloud_setup/
1gj1fyn,built an agent with just FastAPI: small LLMs FTW ðŸ™Œ,"Working on a billing AI agent for small business owners - help generate and create invoices. Started with prompt-engineering and used the function calling workflow of chatGPT. Was slow (~3 seconds to resolve tools) and the devEX was crufty. Tried this open source project https://github.com/katanemo/arch, which essentially uses a custom-built LLM that converts user prompts to APIs passing in structured JSON. Felt super fast. Once my API returned a response, it automatically calls chatGPT to summarize the response. And I just had to write this ðŸ‘‡ðŸ¤¯ (plus a config file for my system prompt, etc). Project offers more features, but writing API code to build a full-blown agent without unnecessary prompt engineering felt really good.",2024-11-03 16:14:41,19,https://i.redd.it/mmxcryy12syd1.jpeg
1gj1e9p,tips for dealing with unused tokens? keeps getting clogged,,2024-11-03 16:12:24,16,https://v.redd.it/9bteq03a1syd1
1gj14oa,Best Open Source Voice Cloning if you have lots of reference audio?,"Hey everyone,

I've been using ElevenLabs for awhile but now want to self-host. I was really impressed with F5-TTS for its ability to clone using only a few seconds of audio.

However, for my use case, I have 10-20 minutes of audio per character to train on. What voice cloning solutions work best in that case? Ideally, I train the model in advance on each character and then use that model for inference.",2024-11-03 16:00:02,21,https://www.reddit.com/r/LocalLLaMA/comments/1gj14oa/best_open_source_voice_cloning_if_you_have_lots/
1gizq17,What are your favorite uses of local LLM's that closed source LLM's can't provide?,"I've been meaning to get an AI rig for a while, and with the new M4 just around the corner I wanted to pick your brains.

Does running LLM's locally opens you up to a new ecosystem of AI use cases through the open source world, or does it mostly mirror the closed source experience with the peace of mind that comes with self-hosting?

I'm personally not too affected by data/IP concerns, and want to better compare buying API tokens vs using a local rig.",2024-11-03 14:55:08,38,https://www.reddit.com/r/LocalLLaMA/comments/1gizq17/what_are_your_favorite_uses_of_local_llms_that/
1giz9px,magnum-v4-9b for web-llm,"[https://huggingface.co/oopus/magnum-v4-9b-q4f16\_1-MLC](https://huggingface.co/oopus/magnum-v4-9b-q4f16_1-MLC)

If you are a developer and want to use magnum-v4-9b in your production environment for users to access in a web browser, feel free to try it out.",2024-11-03 14:34:39,5,https://www.reddit.com/r/LocalLLaMA/comments/1giz9px/magnumv49b_for_webllm/
1giy3pt,"Your best 3b model? Llama 3.2, kwen 2.5 or Phi 3.5?","Tested very little since they slow on my device but usable, looks like phi 3.5b might be smartest of these small 3b models? ",2024-11-03 13:43:23,18,https://www.reddit.com/r/LocalLLaMA/comments/1giy3pt/your_best_3b_model_llama_32_kwen_25_or_phi_35/
1giw2lr,Advice wanted or Squeezing Tensor Parallelism Performance out of a PCIe lane constrained z690 motherboard,"My AI rig evolved out of pandemic gaming computer, this is what it looks like today:  
MSI z690 with i9-12900K and 192GB DDR5  
4090 -> pcie 4.0 x8  
4090 -> pcie 4.0 x8  
3090 -> pcie 3.0 x4 (nvme to pcie adapter in x4 cpu lane slot)  
3090 -> pcie 3.0 x4 (3rd physical slot on the board)

In tabbyAPI when I set tensor parallelism to true I went from 10 to 15 tokens per seconds with the Q5 quant of Mistral Large. The advice of ""just get an Epyc/Threadripper"" isn't a good fit for me because I also use this system for gaming/VR as well as booting into linux for AI inference.

Case Situation:  
I am in a Lian Li O11 Dynamic EVO XL case with the 4090s in the front compartment, and the 3090s mounted in HDD drive cages above and below the 1600watt power supply. Every bit of space in the setup is very carefully managed.  


Questions:   
If I could change the 2 3090s from being on pcie 3.0 x4 to pcie 4.0 x4 by switching to nvme based oculink adapters that support 4.0, does anyone know how many more tokens per second is reasonable to expect from Mistral Large q5?

Does anyone know of oculink adapters that can be powered off a regular power supply? I see those 24 pin plugs on them, and I'm wary of splitting my main 24 pin power connector off from that. I also see PD options, but I'd really like to keep everything inside this case without having external power bricks hanging off of it.

Similarly, if I did eventually upgrade to a board with four or more pcie 4.0 x16 slots, how much could I expect tokens per second to go up? ",2024-11-03 12:14:30,7,https://www.reddit.com/r/LocalLLaMA/comments/1giw2lr/advice_wanted_or_squeezing_tensor_parallelism/
1giuvwm,"Cheap ""Fine-tuning""","Hi. As an oldtimer, my idea of a training set is table of feature vectors (or documents/images) with their corresponding labels. Is this the same format that is used to ""fine-tune"" an LLM?

So far, the most intuitive way to do ""classic supervised learning"" with a LLM for me has been the ""in-context way"", i.e. essentially giving my whole training set to the model inside the context, and then ask it to give me the label for the test sample. This seems very inefficient though, if anything for the long context in every call. There must be a better way. 

What are better ways to have an LLM do supervised classification of a text (for simplicity) document for me, that also does not require GPUs or expensive compute?

Many thanks.",2024-11-03 11:24:08,5,https://www.reddit.com/r/LocalLLaMA/comments/1giuvwm/cheap_finetuning/
1gitsek,Urgent New Nvidia Security Warning For 200 Million Linux And Windows Gamers,,2024-11-03 10:37:02,137,https://www.forbes.com/sites/daveywinder/2024/10/25/urgent-new-nvidia-security-warning-for-200-million-linux-and-windows-gamers/
1git52m,Incremental fine tuning,"I've created my own (statically type checked) programming language and I'd like to teach a LLM how to code in it. My idea is to:

1. Get the LLM to generate a programming challenge, a proposed solution written in my language and a test case.
2. If the one-shot generated code passes the test then add it to training set. If it fails then fix it manually and add the fix to the training set.
3. Run a single step of fine tuning.
4. Repeat until the LLM is proficient in my language.

Is it feasible to change the training data every step like this?",2024-11-03 10:09:33,11,https://www.reddit.com/r/LocalLLaMA/comments/1git52m/incremental_fine_tuning/
1girzia,Exploring AI's inner alternative thoughts when chatting,,2024-11-03 09:20:05,239,https://v.redd.it/szdebv40ypyd1
1girn7t,"tldw (open source NotebookLM) - Sharing a tool I've been working on for the past several months, similar to NotebookLM, but self-hosted/can be ran entirely local on linux/mac/windows (no podcast creation though, yet)","tl/dr: WIP project, still beta-status, python-based RAG chat front end with capability to ingest various media, store it in sqlite DBs, and make it available for review/chatting via RAG. Chunking is user-tweakable, for raw data and embeddings. Possible to use local embeddings(HuggingFace/Llama.cpp) or OpenAI. Also has character card support. UI is bad/a placeholder, goal is to get to 'feature completion' and then migrate to FastAPI + Custom JS frontend. Looking to share/get feedback/opinions on it. Goal is to create a tool that can help others save time and keep their data in their hands.  
The tool: [https://github.com/rmusser01/tldw](https://github.com/rmusser01/tldw)

Demo doesn't currently work, (issue with Gradio/HF), plan to setup another one in the next few days, but in the meantime here is a video walkthrough of a fresh installation: [https://github.com/rmusser01/tldw/blob/main/Docs/Screenshots/tldw-run-through-blank.webm](https://github.com/rmusser01/tldw/blob/main/Docs/Screenshots/tldw-run-through-blank.webm)

I started working on a project to help me consume conference presentations at a faster rate, then found out about NotebookLM and thought 'why not extend it to have that featureset?'. Have been working on it for the past several months, and is at a point where I feel slightly more comfortable sharing it. Its open source, licensed under Apache 2.0. Started out as a fork of \`the-crypt-keeper\`'s tldw project for transcribing youtube videos, and has since grown from a 500 line script to a 60k+(?) line application.

Features:

\- API support for 15 different ones, OpenAI, Cohere, Anthropic, OpenRouter, DeepSeek, Mistral, Groq, and HuggingFace for commercial, Local: Llama.cpp, Kobold.cpp, oobabooga, TabbyAPI, vllm, ollama, aphrodite, custom OpenAI API.

\- Ingest/download/transcribe videos from local files or URLs(yt-dlp is used, so youtube+2k other sites are supported)

\- Same for audio/podcasts/ebooks/plaintext/xml

\- Web Scraping pipeline for individual URLs, sitemap, complete URL(scrape entire root domain), Recursive Scraping(scrape everything under a specific URL)

\- PDF ingestion using pymupdf(Plan is to upgrade it to pymupdf4llm and also integrate docling so the user can decide which works better)

\- Live Transcription/recording

\- Arxiv API integration, so you can search for papers on arxiv and ingest them from the app.

\- RAG Search + Chat - Two current modes, 1 query search and ongoing chatting use RAG with your choice of which DB to use(Media, Conversations, Notes, Character Chats)

\- Note taking in the RAG Chat ala NotebookLM. Have the ability to edit/modify notes + add keyword tagging (with support for meta-keyword collections, WIP)

\- Regular old LLM chat, 4 different UI styles, 2 being vertical/horizontal, the other 2 being 4-API chat, so 4 chat windows with different APIs in one window, and the other is 3 APIs but one prompt, so you can see how different APIs respond to the same input.

\- Character chat support - its no sillytavern, but it has support for character card importing/creation/editing/export. (The eventual goal is to build a replica of the Digital Primer from the Diamond Age)

\- Some basic writing tools for analysis/review

\- Search across it all via FTS5 from sqlite (full text search with keyword support)

\- Prompt DB with the option to add/edit/clone/delete prompts. Also all stored in a separate SQLite DB.

\- Embeddings creation for all/specific content (WIP)

\- Keyword Search/viewing for all DBs

\- Import Functionality - support for mass ingestion of txt/md files as well as obsidian vaults, prompts(single or multiple) and mediawiki dumps

\- Support for exporting it all (Its all SQLite backed anyways, so at worse you could just write raw manual sql queries against the DB)

\- DB Backup/Restore - Support for creating Full/Incremental DB backups (ToDo is writing up a doc explaining how to do invisible/offsite backups with litestream)

\- PlantUML mindmap creator (PoC, but goal is to be able to create mindmaps from your content for review)

\- Anki Deck Creation/Validation/editing - Ability to create a working anki deck, also validate it to make sure it works(?), Editing is in but not working.

\- Support for running/hosting LLMs locally using Llamafile/Ollama

\- Trashcan support for the Media DB to prevent accidental deletion of media items. (15 day period before deletion actually occurs, with the option for manual override)

\- Config Editing page in the app, so you can modify the config file from your browser.

Any feedback is welcome/wanted. The README isn't the greatest, but its on my todo list.  
If there's a feature you'd like to see/suggest, please first look at [https://github.com/rmusser01/tldw/issues](https://github.com/rmusser01/tldw/issues) to see the features I currently have planned.

Edit: My notes on RAG [https://github.com/rmusser01/tldw/blob/main/Docs/RAG\_Notes.md](https://github.com/rmusser01/tldw/blob/main/Docs/RAG_Notes.md)  
and my RAG pipeline: [https://github.com/rmusser01/tldw/blob/9effd1865d2e6dedc57b306c511a25b21bc6f940/App\_Function\_Libraries/RAG/RAG\_Library\_2.py#L131](https://github.com/rmusser01/tldw/blob/9effd1865d2e6dedc57b306c511a25b21bc6f940/App_Function_Libraries/RAG/RAG_Library_2.py#L131)",2024-11-03 09:05:30,28,https://www.reddit.com/r/LocalLLaMA/comments/1girn7t/tldw_open_source_notebooklm_sharing_a_tool_ive/
1gir1by,Is smollm only 8k context?,"Man, it works beautifully for my needs, but that context is just way too short. Any way to bump that to 128K?",2024-11-03 08:39:37,3,https://www.reddit.com/r/LocalLLaMA/comments/1gir1by/is_smollm_only_8k_context/
1giqxph,"ðŸš€ Analyzed the latency of various TTS models across different input lengths, ranging from 5 to 200 words!",,2024-11-03 08:35:18,100,https://i.redd.it/5xis63lvrpyd1.png
1giqgck,"My Experience: Long Time Techie, First Time Local Model Execution (GPT4ALL)","Few things:  I've been in IT professionally (top 3 firms) for 35 years.  I've been doing geeky stuff for 45 years.  Let that sink in.  Ok, I'm not that old, but the majority of you reading this post won't appreciate dial-up modems, blue-boxing the local payphones or social engineering a sitting president with a nuke warning - while mounted on a Huffy because I couldn't drive yet (and the legal limit was 14 for a learners permit).

That being said, I can say this: I'm impressed.  But also horrified.

**PROS**:

1. The tech is smooth and modern - what's to hate?  (I do have an i9-11xxx with 64GB DDR4, fast NVMe and a 2080 super).
2. The implementation is crisp and aligned with industry trends (RAG, popular model selection and more!)
3. The experience is moderate in terms of learning curve.  My main holdbacks were the 'options', and it's like trying to explain Air-Fuel Ratios to someone who's been working on bicycles their entire life.  Gonna take a second or two, and I'm still only 10% into what I think I know, which means I know precisely squat.  Lots to learn!

**CONS**:

*Safety*.

Safe - how do you keep a hammer safe?  A hammer can be used to both build a house and unalive a person.  I may do both in a 'shit hits the fan situation', but maybe I don't have a hammer and only 12ga shotgun shells, and a horde of zombies are my door?

  
I need to be able to research ANYTHING ... in a potential scenario where I'd like to do something illegal according to normal, customary laws in my supposed jurisdiction.  However, that exact 'thing' I wish to research, is considered 'allowed' in times of crisis or national emergency.

  
While I wish I could lawyer up more (IANAL), I definitely think laws preside and are in effect during 'normal' circumstances.  But when those circumstances \[requiring knowledge\] occur - I won't be very pleased and forgiving if the LLM in which I'm asking questions to save my life or that of someone else - decides I'm flirting with morals.

Examples:

* General, Run of the Mill Extended Beyond 60 Days SHTF \[*morphine from poppies, where to find antibiotics*\]
* Local Supernova / Solar Flare X99 \[*nuclear gamma shielding, how to build a tester*\]
* COVID.next \[*ivermectin information and covid relationship and treatment options*\]
* I AM Legend lion-style attacks \[*expedient firearms and how to defend your yard with booby traps*\]
* Clearing roads after flooding \[*lower order explosives, and how to make detonators*\]



Be scared all you want.  Knowledge is power, and in the right hands, it can save lives.  


**Proposal / Request for Feedback**:

(for GPT4ALL, at least)

A guard-rail free mode?  If the issue of subpoena arises, a download to the Guardrail Free version can be audited, and provided upon proper court subpoena.   The data is incredibly benign, and of no more risk than that of GitHub being breached by a bad actor and all of our emails being (re-re-re-sold) on the darkweb.



...

C'mon for f's sake - this is 2024.  We're not luddites, and knowledge cannot be siphoned.



# ""The wise man is like a river that flows freely, sharing its waters with all.""



\- The Instructions of Shuruppak - 3000 BCE

",2024-11-03 08:14:39,0,https://www.reddit.com/r/LocalLLaMA/comments/1giqgck/my_experience_long_time_techie_first_time_local/
1giozl9,"Speaking with your local LLM with a key press on Linux. Speech to text into any window, most desktop environments. Two hotkeys are the UI.","Linux users who want snappy, low-resource speech-to-text input and local LLM answer generation that are both available to paste in any window and spoken back,  check out [BlahST on Github](https://github.com/QuantiusBenignus/BlahST).

Uses fast, optimized system tools and shell built-ins (no Python, no JS) to orchestrate whisper.cpp (or [whisperfile](https://huggingface.co/Mozilla/whisperfile) or whisper.cpp server), local llama.cpp (or [llamafile](https://github.com/Mozilla-Ocho/llamafile) or llama.cpp server) and [Piper TTS](https://github.com/rhasspy/piper), to input speech or interact with an LLM, in a UI-less fashion, triggered only by a keyboard hotkey.

A demo (please, unmute. More videos in repo):

[In the above video, the audio starts with the system announcing screen-casting \(my GNOME extension \[\\""Voluble\\""\]\(https:\/\/github.com\/QuantiusBenignus\/voluble\) speaks out-loud all GNOME desktop notifications\), followed by multiple turns of speech input\/recognition. Demonstrated at the end is one of the \\""AI functions\\"" which uses the text transcribed by BlahST \(whisper.cpp\), formats it into a LLM prompt and sends it to a local multilingual LLM \(using llama.cpp or llamafile\) which returns the Chinese translation as text and also speaks it using a neural TTS. Orchestrating this from the command line with lean executables leaves the system surprisingly snappy \(From the video you can see that the PC barely breaks any sweat - temperatures remain low-ish.\)](https://reddit.com/link/1giozl9/video/k5381oka5pyd1/player)

Lean and mean, still WIP. (Demo system is a previous gen. Ryzen w. RTX3060, CUDA kernels used with llama.cpp cli (\~34 tok/s with gemma-9b-Q6) and whisper.cpp server. \~90x real time factor on speech inference.)",2024-11-03 07:10:26,44,https://www.reddit.com/r/LocalLLaMA/comments/1giozl9/speaking_with_your_local_llm_with_a_key_press_on/
1gindy1,Looks like Intel Arrow Lake can support 4 DIMMs @ up to 6400 speeds,"After searching through a few boards, it looks like Arrow Lake can do 4 Dimms @ 6400.  For an ASrock example, see below - select vendor ""Corsair"", and there is a 24GB per DIMM options @ 6400.  Crucial and ADATA have 48GB ""4 channel"" options @ 5600.

[https://www.asrock.com/mb/Intel/Z890%20Taichi/index.asp#MemoryARLK](https://www.asrock.com/mb/Intel/Z890%20Taichi/index.asp#MemoryARLK)

A quick search on ASUS for an ""affordable"" board shows 4x16GB @ 6000 speeds:

[https://www.asus.com/us/motherboards-components/motherboards/prime/prime-z890m-plus-wifi/helpdesk\_qvl\_memory?model2Name=PRIME-Z890M-PLUS-WIFI](https://www.asus.com/us/motherboards-components/motherboards/prime/prime-z890m-plus-wifi/helpdesk_qvl_memory?model2Name=PRIME-Z890M-PLUS-WIFI)

Another ASUS board supports 4x16GB @ 6600, though there's only a QVL for 4x32GB @ 5200:

[https://www.asus.com/us/motherboards-components/motherboards/tuf-gaming/tuf-gaming-z890-pro-wifi/helpdesk\_qvl\_memory?model2Name=TUF-GAMING-Z890-PRO-WIFI](https://www.asus.com/us/motherboards-components/motherboards/tuf-gaming/tuf-gaming-z890-pro-wifi/helpdesk_qvl_memory?model2Name=TUF-GAMING-Z890-PRO-WIFI)

Anyway just wanted to pass along that we may see ""certified"" 6400+ speed 4 DIMM setups become common with Arrow Lake (Core Ultra 200 series).   An x86 way to have 192GB-256GB (when DIMMs are available) on a standard desktop at reasonable speed. ",2024-11-03 05:55:51,27,https://www.reddit.com/r/LocalLLaMA/comments/1gindy1/looks_like_intel_arrow_lake_can_support_4_dimms/
1gin6jd,My LLM developer side project. Any recommendations on what local models might work with this?,"Github: [https://github.com/Nero7991/devlm](https://github.com/Nero7991/devlm)

It allows LLM to take actions (edit files, run processes and cmd, etc) and provides outputs to due that action. Also, provides dynamic context related to a given project. I'm currently using the Claude Sonnet 3.5 as the LLM. I'd really like to know if any local LLMs would be this good. Currently, the issues seem to be  the needle in a haystack problem where it ignore certain key points in the previous actions and just general lack of advanced reasoning (maybe this could be amplified due to the needle in a haystack problem). I'd love your thoughts. I've tried llama 3.1 8b and it does not do well at all but a coding/devops specific larger model might be much better I guess. Any recommendations?",2024-11-03 05:46:03,6,https://www.reddit.com/r/LocalLLaMA/comments/1gin6jd/my_llm_developer_side_project_any_recommendations/
1gin2y0,LLM 4 GPUs rig stability problem,"I have remote PC which I usually access by SSH. (I made a post about benchmarking it when it only had 2 GPUs - [https://www.reddit.com/r/LocalLLaMA/comments/1erh260/2x\_rtx\_3090\_threadripper\_3970x\_256gb\_ram\_llm/](https://www.reddit.com/r/LocalLLaMA/comments/1erh260/2x_rtx_3090_threadripper_3970x_256gb_ram_llm/) )   
  
I will repeat shortly so no one has to visit another link.

My motherboard is Gigabyte TRX40 Designare. It has 4 2-slot-width PCIe slots, x16-x8-x16-x8. Parts are (everything except RAM and some PSUs is used, tried to stay on budget):

* 2x3-slot EVGA RTX 3090 (default power limit 350W, never exceeds 275W)
* 2x2 slot ASUS RTX 3090 Turbo,
* 1 PCIe riser cable (Lian Li 60cm, PCIe 3.0 x16).
* daisy-chained PSUs, 1500W and 2000W capable
* Threadripper 3970X
* 8x32 GB of DDR4 RAM
* NVMe 2TB disk (moved to the slot connected to motherboard, in order to free some PCIe lanes for GPUs, just in case)

In BIOS, I have

* Above 4G coding enabled, 48 bits
* Resizable BAR enabled
* CSM support disabled (didn't boot last time I checked with that)
* PCIe set to 3.0 (won't boot otherwise with PCIe resources error BIOS boot code)

The system does not simply boot. GPU->PCIe slots configuration when it at least boots to the state I can SSH into it is

* \------ x16 RTX 3090 Turbo
* \------ x8  RTX 3090 Turbo
* \------ x16 PCIe riser cable -> RTX 3090
* \------ x8 RTX 3090 (it is 3-slot, so this must sit here to not cover any slots - I can interchange anything in slots above however)

This system works fine with 2 GPUs, with some tricks it works with 3 GPUs, although I already have to downgrade PCIe to 3.0.

The problem:

sometimes it boots with all 4 GPUs, then I see 'GPU disconnected/lost from bus' error in dmesg, and there are just 2 GPUs. Sometimes I see 2 GPUs visible at the time of [network.target](http://network.target) passed in systemd (I wrote systemd service to check), one RTX 3090 and one RTX 3090 Turbo, not sure from which slots (I identify them by their max default power in nvidia-smi).

Each of them has idle power (whether 4 or 2 are loaded) at 100W-120W level. Two of RTX 3090 Turbo, which are close in top slots, get temperature of about 70 C in a minute or two just with that. Not sure if this is related, because when they work in tandem (only Turbos), they reach even 90 C without any problem.

Sometimes time before system boots up is exceedingly long - there is some long shutdown happening.

What I tried unsuccessfully:

* limiting power
* setting higher fan speed manually
* limiting clock
* playing with GRUB command line in /etc/default/grub (adviced by Claude AI, don't laugh at me, I was kinda desperate)
* playing with /etc/modprobe.d/nvidia.conf (adviced by Claude AI)
* understanding PCIe lanes map to devices (which I guess is useful, Claude AI taught me the command)

What I am going to try based on my reading from internet:

* install older NVidia driver
* disabled Resizable BAR (it should mostly be used for gaming)
* disable power states of Threadripper (this is probably causing power spikes)
* try to move PCIe riser cable to 1st or 2nd slot (is it will be first, all 3 GPUs will be close, pity for their temps)
* enable CSM again

I am now trying driver reinstall, waiting for reboot to finish.

Any help appreciated...",2024-11-03 05:41:03,5,https://www.reddit.com/r/LocalLLaMA/comments/1gin2y0/llm_4_gpus_rig_stability_problem/
