1gheslj,Testing llama.cpp with Intel's Xe2 iGPU (Core Ultra 7 258V w/ Arc Graphics 140V),"I have a Lunar Lake laptop (see my [in-progress Linux review](https://github.com/lhl/linuxlaptops/wiki/2024-MSI-Prestige-13-AI--Evo-A2VM)) and recently sat down and did some testing on how llama.cpp works with it.

* Chips and Cheese has the [most in-depth analysis of the iGPU](https://chipsandcheese.com/p/lunar-lakes-igpu-debut-of-intels) which includes architectural and real world comparisons w/ the prior-gen Xe-LPG, as well as RDNA 3.5 (in the AMD Ryzen AI 9 HX 370 w/ Radeon 890M).
* The 258V has 32GB of LPDDR5-8533, which has a theoretical maximum memory bandwidth of  136.5 GB/s. Chips and Chesee did some [preliminary MBW testing](https://chipsandcheese.com/i/149978169/cache-and-memory-bandwidth) and found actual throughput to be around 80 GB/s (lower than Strix Point), but MBW test is hard...
* The 140V Xe2 GPU on the 258V has Vector Engines with 2048-bit XMX units that Intel specs at 64 INT8 TOPS. Each XMX can do INT8 4096 OPS/clock or FP16 2048 OPS/clock, so that would be a max theoretical 32 FP16 TOPS.

For my testing, I use Llama 2 7B (specifically the q4\_0 quant from \[TheBloke/Llama-2-7B-GGUF\]) as my standard benchmark (it is well quantified and has max compatibility). All testing was done with very-up-to-date HEAD compiles (`build: ba6f62eb (4008)`) of llama.cpp. The system itself is running [CachyOS](https://cachyos.org/), a performance focused Arch Linux derivative, and it is running the latest 6.12 kernel `6.12.0-rc5-1-mainline` and `linux-firmware-git` and `mesa-git` for the maximum support for Lunar Lake/Xe2.

My system is running at PL 28W (BIOS: performance), with the performance governor, EPP, and EPB.

It turns out there are quite a few ways to run llama.cpp - I skipped the NPU since it's a PITA to setup, but maybe I'll get bored sometime. Here's my results:

|Backend|pp512 t/s|tg128 t/s|t/TFLOP|MBW %|
|:-|:-|:-|:-|:-|
|[CPU](https://github.com/ggerganov/llama.cpp/)|25.05|11.59|52.74|30.23|
|[Vulkan](https://github.com/ggerganov/llama.cpp/blob/master/docs/build.md#vulkan)|44.65|5.54|1.40|14.45|
|[SYCL FP32](https://github.com/ggerganov/llama.cpp/blob/master/docs/backend/SYCL.md)|180.77|14.39|5.65|37.53|
|[SYCL FP16](https://github.com/ggerganov/llama.cpp/blob/master/docs/backend/SYCL.md)|526.38|13.51|16.45|35.23|
|[IPEX-LLM](https://github.com/intel-analytics/ipex-llm/blob/main/docs/mddocs/Quickstart/llama_cpp_quickstart.md)|708.15|24.35|22.13|63.51|

* pp is prompt processing (also known as prefill, or input) - this is the speed at which any system prompt, context, previous conversation turns, etc are passed in and is compute bound
* tg is token generation (aka output) - this is the speed at which new tokens are generated and is generally memory bandwidth bound
* I've included a ""t/TFLOP"" compute efficiency metric for each Backend and also a MBW % which just calculates the percentage of the tg vs the theoretical max tg (136.5 GB/s / 3.56GB model size)
* The CPU backend doesn't have native FP16. TFLOPS is calculated based on the maximum FP32 that AVX2 provides for the 4 P-Cores (486.4 GFLOPS) at 3.8GHz (my actual all-core max clock). For those interested on llama.cpp's CPU optimizations, I recommend reading jart's writeup [LLaMA Now Goes Faster on CPUs](https://justine.lol/matmul/)
* For CPU, I use `-t 4`, which uses all 4 of the (non-hyperthreaded) P-cores, which is the most efficient setting. This basically doesn't matter for the rest of the GPU methods.

For SYCL and IPEX-LLM you will need to install the [Intel oneAPI Base Toolkit](https://www.intel.com/content/www/us/en/developer/tools/oneapi/base-toolkit-download.html). I used version 2025.0.0 for SYCL, but IPEX-LLM's llama.cpp requires 2024.2.1

* Setup docs to [Run llama.cpp with IPEX-LLM on Intel GPU](https://github.com/intel-analytics/ipex-llm/blob/main/docs/mddocs/Quickstart/llama_cpp_quickstart.md) \- as of testing, the llama.cpp was based off of a 2024-08-22 version

The IPEX-LLM results are much better than all the other Backends, but it's worth noting that despite the docs suggesting otherwise, with the Xe2 Arc 140V GPU atm, it **doesn't** seem to work with k-quants ([related to this error?](https://github.com/intel-analytics/ipex-llm/issues/11080)). Still, at 35% faster pp and 80% faster tg than SYCL FP16, it's probably worth trying to use this if you can.

# vs Apple M4

I haven't seen any M4 inference numbers, yet, but this chart/discussion [Performance of llama.cpp on Apple Silicon M-series #4167](https://github.com/ggerganov/llama.cpp/discussions/4167) is a good reference. The M3 Pro (18 CU) has [12.78 FP16 TFLOPS](https://www.cpu-monkey.com/en/igpu-apple_m3_pro_18_core) and at 341.67 t/s pp, that gives a \~26.73 t/TFLOP for Metal performance. The new M4 Pro (20 CU) has an [expected 17.04 TFLOPS](https://www.cpu-monkey.com/en/igpu-apple_m4_pro_20_core) so at the same efficiency you'd expect \~455 t/s for pp. For MBW, we can again run similar back-calculations. The M3 Pro has 150 GB/s MBW and generates 30.74 t/s tg for a 73% MBW efficiency. at 273 GB/s of MBW, we'd expect the M4 Pro to have a ballpark tg of \~56 t/s.

# vs AMD Ryzen AI

The [Radeon 890M](https://www.techpowerup.com/gpu-specs/radeon-890m.c4224) on the top-end Ryzen AI Strix Point chips have 16CUs and a [theoretical 23.76 TFLOPS](https://gpuspecs.com/theoretical-performance-calculator), and with LPDDR5-7500, 120GB/s of MBW. Recently AMD just published an article [Accelerating Llama.cpp Performance in Consumer LLM Applications with AMD Ryzenâ„¢ AI 300 Series](https://community.amd.com/t5/ai/accelerating-llama-cpp-performance-in-consumer-llm-applications/ba-p/720311) testing the performance of a Ryzen AI 9 HX 375 with a Intel Core Ultra 7 258V. It mostly focuses on CPU and they similarly note that llama.cpp's Vulkan backend works awfully on the Intel side, so they claim to compare Mistral 7B 0.3 performance w/ IPEX-LLM, however they don't publish any actual performance numbers, just a percentage difference!

Now, I don't have a Strix Point chip, but I do have a 7940HS with a Radeon 780M (16.59 TFLOPS) and dual channel DDR-5600 (89.6 GB/s MBW) so I ran the same benchhmark on a Mistral 7B 0.3 (q4\_0) and did do some ballpark estimates:

|Type|pp512 t/s|tg128 t/s|t/TFLOP|MBW %|
|:-|:-|:-|:-|:-|
|140V IPEX-LLM|656.5|22.98|20.52|64.48|
|780M ROCm|240.79|18.61|14.51|79.55|
|projected 890M ROCm|*344.76*|*24.92*|14.51|79.55|

I just applied the same efficiency from the 780M results onto the 890M specs to get a projected performance number.

Anyway, I was pretty pleasantly surprised by the IPEX-LLM performance and will be exploring it more as I have time.",2024-11-01 13:16:00,50,https://www.reddit.com/r/LocalLLaMA/comments/1gheslj/testing_llamacpp_with_intels_xe2_igpu_core_ultra/
1gheq9t,IMO the best model for agents: Qwen2.5 14b,"For a long time, I have been running an engineered CoT agent framework that used GPT 4, then 4o for a while now.

Today, I deployed Qwen2.5 14b and I find it's function calling, CoT reasoning, and instruction following to be fantastic. I might even say, better than GPT 4/4o. For all my use cases, anyway.

p.s. I run this on RunPod using a single A40 which is giving me some decent tokens per second and seems reliable. I set it up using Ollama and the default quantized Qwen2.5 14b model. An A40 is for faster tokens per second, but I imagine you could get away with much smaller for your own needs. Either way, this is at least something I can get my hands on locally, so my next project will be to set this up at home and host it over my home fibre connection to save even more dollars.",2024-11-01 13:13:14,177,https://www.reddit.com/r/LocalLLaMA/comments/1gheq9t/imo_the_best_model_for_agents_qwen25_14b/
1ghd2qy,Thoughts on a maxed out m4 mac mini for local LLMs?,"I'm not much of a hardware guy, but my curiosity with new technology has me pushing some limits and I need to upgrade from my i5 macbook pro. Is there consensus yet on how a maxed out mac mini for a littler over $2k compares to other hardware setups for LLM / genAI inference? Will I be severely limited by only 64gb of ram? Is it more cost effective to get an m2 studio? Or do I just wait another year until there's a new generation of studios?",2024-11-01 12:00:58,6,https://www.reddit.com/r/LocalLLaMA/comments/1ghd2qy/thoughts_on_a_maxed_out_m4_mac_mini_for_local_llms/
1ghcm6k,Chinese army scientists use Meta technology to create â€˜military AIâ€™,"This kind of article is just ridiculous and they will try to use arguments like that to discourage open source model.

In fact, Chinese military is stupid using llama as they have local models that are just as capable, if not more from Chinese companies.",2024-11-01 11:40:37,256,https://www.telegraph.co.uk/business/2024/11/01/chinese-scientists-use-meta-technology-create-military-ai/
1ghc0ck,Adding a cheaper GPU to a 4090 to increase VRAM,"At the company I work for, there might be space in the budget of our unit for an NVIDIA P40 or M40 24GB. We have a nice workstation with a 4090 that I have suggested we use for running local llms for coding assistants and RAG pipelines, so that we keep everything private and we get to learn something about these tools when setting them up.   
I have heard that when there are 2 gpus in the system, Ollama will use the VRAM off both, but only use one for the computations. A very optmistic voice inside my head tells me that it will work fine with two completely different gpus belonging to different generations, but rationally I think there might be issues.   
Does anyone have any experience with this type of setup? Are there clear reasons why this might not work at all?

Thank you in advance",2024-11-01 11:15:04,10,https://www.reddit.com/r/LocalLLaMA/comments/1ghc0ck/adding_a_cheaper_gpu_to_a_4090_to_increase_vram/
1ghbmoq,"Docling is a new library from IBM that efficiently parses PDF, DOCX, and PPTX and exports them to Markdown and JSON.",,2024-11-01 10:59:02,608,https://github.com/DS4SD/docling
1ghbcby,gptme.vim - vim plugin for gptme integration,,2024-11-01 10:46:31,3,https://github.com/ErikBjare/gptme/tree/master/scripts/vim
1ghbbbt,is it possible to run a AMD 7600 xt with a P40 or M40 on linux?,My main GPU is a 7600 xt on linux mint. it works great for everything I need but it would be nice if my local LLM ran a little faster. would it be worth it for me to buy a P40 or M40 as a secondary GPU? has anyone done it?,2024-11-01 10:45:19,2,https://www.reddit.com/r/LocalLLaMA/comments/1ghbbbt/is_it_possible_to_run_a_amd_7600_xt_with_a_p40_or/
1ghaz6q,Just tried out Semantic Kernel in .NET,"Iâ€™m a .net developer and until now I was using Python to interact with local models, but this means I can use my trusty .NET from now on. Has anyone else have any experience with Semantic Kernel in .NET?",2024-11-01 10:31:04,22,https://i.redd.it/vmbxuxa8sbyd1.jpeg
1gh9v47,"Paper & Code: 
Language Models can Self-Lengthen to Generate Long Texts",,2024-11-01 09:43:45,69,https://github.com/QwenLM/Self-Lengthen
1gh9hhz,RTX 4060 Windows->Linux ,This is little off topic question. I have Windows laptop with Nvidia RTX 4060. I am planning to replace Windows OS with Linux on it. Will there be any issues if I do that? I know the steps how to do that but if anyone has shifted from Windows to Linux then please share your experience.,2024-11-01 09:27:44,2,https://www.reddit.com/r/LocalLLaMA/comments/1gh9hhz/rtx_4060_windowslinux/
1gh9ezo,Are ADA generation cards actually better than Ampere in all use cases?,"So I was having a quick look at the specification differences between the ampere and Ada generation RTX cards and noticed that the ""equivalent"" models over the two generations actually lose memory bandwidth in ADA:

https://preview.redd.it/lc69yj4ffbyd1.png?width=1516&format=png&auto=webp&s=b823c01a14e8cab8c6926b53f9cd84e91e9a654f

I appreciate the available VRAM and clock speeds are higher, as well as a significant difference in the TFLOPs from the tensor cores, but is this not an unnecessary bottleneck for the kind of work they are designed for? 

I also had a quick look at the RTX 4000 ADA vs the Ampere RTX A5000, on most of the benchmarks, the RXT 4000 ADA is 9% ""better"" than the RTX A5000, but the memory bandwidth is even lower. Couple that with the fact that none of the ADA generation appear to have NVlink, I'm wondering whether there are actually advantages to sticking to ampere cards. The efficiency per watt appears to be drastically better on the Ada generation cards, so I'm wondering whether the main difference is actually aimed at the enterprise running cost metric, rather than actually being a generational leap in raw performance. 

Just thought I'd open it up for discussion, because I feel like I'm missing something blindingly obvious here.",2024-11-01 09:24:44,2,https://www.reddit.com/r/LocalLLaMA/comments/1gh9ezo/are_ada_generation_cards_actually_better_than/
1gh8h5u,Anyone familiar with AudioLM (TTS)?,I see a lot of questions about local TTS models but haven't heard much about this. Apparently it's what Google uses for the notebook podcast. There is an [implementation of it on github](https://github.com/lucidrains/audiolm-pytorch) but it looks like it takes a bit of training to get it working. I haven't seen any samples of it (other than from the original Google paper)â€”has anyone here got this working? Or know how tough it might be to get up and running?,2024-11-01 08:45:46,9,https://www.reddit.com/r/LocalLLaMA/comments/1gh8h5u/anyone_familiar_with_audiolm_tts/
1gh7z7b,simplemind: Python API client for AI providers that intends to replace LangChain and LangGraph for most common use cases,,2024-11-01 08:24:21,16,https://github.com/kennethreitz/simplemind
1gh7yae,gptme v0.22.0 released - now with early support for Anthropic-style computer use!,,2024-11-01 08:23:14,3,https://github.com/ErikBjare/gptme/releases/tag/v0.22.0
1gh7nu0,The unreasonable power of the seed,"We talk about how to optimize output from LLM's, but it seems the seed doesn't get any attention?

In my experience (smaller) AI models can give *wildly* different results depending on the random seem they start with. I've tried locking it down to \`42\` to get more predictability. But maybe 42 isn't the answer this time?

\- How much variation in output does it cause compared to other factors? Is there any research into how large this factor's influence is?   
\- Are there some models that you'd recommend a specific seed for? Is there a list of ""bad seeds""? (Maybe I should ask Nick Cave).  
\- Is there a LLM testing suite that allows you to run the same test multiple times, while only varying the seed? (and setting temperature to zero obviously).",2024-11-01 08:10:40,0,https://www.reddit.com/r/LocalLLaMA/comments/1gh7nu0/the_unreasonable_power_of_the_seed/
1gh7bk7,M4 Max 128GB (t/s and fine-tuning) speculation?,"Based on the specs you've seen so far, do you think the M4 Max with 128GB of RAM will be slow at context above 4k? Moreso time to first token for say...a 100GB Q8 quant of Mistral Large 2407. I'm guessing that will at least run 4-5 t/s.

I have seen people saying good things about MLX but haven't tested it myself because I'm stuck with M2 Air 8GB for the time being.

And is it possible to fine tune or the heat generated from hours of sustained fine tuning could shorten the lifespan?",2024-11-01 07:56:16,2,https://www.reddit.com/r/LocalLLaMA/comments/1gh7bk7/m4_max_128gb_ts_and_finetuning_speculation/
1gh62bl,Building with speech-to-speech models,"We have a few speech-to-speech open weight models available now (e.g. GLM-4-Voice, Ichigo, Moshik(a/o)...). I'm wondering what we'll do to build something that runs locally and can do more than just chat with those new models.

With text-to-text models we have a lot of tools available (e.g. guided generation, function calling...), to get other things to happen beyond just a loop of human turn -> LLM turn...

How would we go about building more complicated user experiences with speech-to-speech models?

My first thought is, during the conversation, do STT and parse that text and do something based on it (perhaps including a text-to-text LLM in the pipeline) to get useful things to happen. Maybe the speech-to-speech LLM you're chatting with doesn't need to know about what happened, but if it does, getting that back into the conversation seems tricky. You could, in theory, do TTS and feed that in to the speech-to-speech model, but I'm not sure we have any tooling for that yet. 

Not sure if this is more of a discussion or a question. Perhaps this is a solved problem and I'm just not aware of the solution. I'd love to hear folks thoughts",2024-11-01 06:59:52,4,https://www.reddit.com/r/LocalLLaMA/comments/1gh62bl/building_with_speechtospeech_models/
1gh5x25,Best model for web design with hugo or wordpress?,"Hi all
what's the best open source model to develop a static website with hugo or wordpress? I have tried Mistral-Nemo-Instruct-2407 and can't get hugo to work. apparently the model uses old hugo version and a lot of deprecated codes.

I am fairly blind in website development but need to create a website. squarespace is just too expensive for me. I have access to pc that can run locallama .

thank you for suggestion",2024-11-01 06:53:02,3,https://www.reddit.com/r/LocalLLaMA/comments/1gh5x25/best_model_for_web_design_with_hugo_or_wordpress/
1gh5mgz,[mlx-lm] Quantized KV Cache (#1075) Â· ml-explore/mlx-examples@85ffd2c,,2024-11-01 06:38:59,28,https://github.com/ml-explore/mlx-examples/commit/85ffd2c96a45a8cb900f95a2ded61d858d673399
1gh5gk0,Computer use support (Anthropic-style) just merged into gptme!,,2024-11-01 06:31:36,24,https://i.redd.it/c1w4z54flayd1.png
1gh4wgz,Do most people run LLMs in gguf format locally?,Maybe it's a dumb question sorry ðŸ˜…,2024-11-01 06:05:21,84,https://www.reddit.com/r/LocalLLaMA/comments/1gh4wgz/do_most_people_run_llms_in_gguf_format_locally/
1gh4ht7,Are confidence scores from LLMs meaningful?,"I see a lot of studies prompting LLMs to make a classification decision or some other type of decision and to report a confidence score -- for example, ""Provide a score from 1 (low) to 10 (ten) rating your confidence in this classification."" LLMs follow the instructions, but is the actual score meaningful? This would imply that the models have meta-cognition to appraise their decision-making. This may be possible with the new reasoning layer of ChatGPT. However, based on how models are predicting words, this confidence rating seems to be more of an artifact of how LLMs work as opposed to being truly meaningful.  ",2024-11-01 05:45:07,19,https://www.reddit.com/r/LocalLLaMA/comments/1gh4ht7/are_confidence_scores_from_llms_meaningful/
1gh30fi,Local model for speaker recognition from voice sample?,"I have dived recently into speaker diarization. I'm currently using WhisperX (which relies on Whisper and Pyannote) to detect speakers and transcribe audio. However, speech diarization from Pyannote labels each speaker with a digit. Is it possible to give a model a few examples of a voice so it can recognize and arbitrarily label such voice?",2024-11-01 04:20:35,3,https://www.reddit.com/r/LocalLLaMA/comments/1gh30fi/local_model_for_speaker_recognition_from_voice/
1gh2zs3,Running AI on CPU to get more RAM,"Hi! I am wondering, for example if I had a 8 core 16 therad CPU like a 5900hx with 32 gigs of RAM and I tryed to run some models on it, would it be better for running big AI models then for example running the model on an 8 gigabyte 2080?",2024-11-01 04:19:30,5,https://www.reddit.com/r/LocalLLaMA/comments/1gh2zs3/running_ai_on_cpu_to_get_more_ram/
1gh27a6,Are there any models(>200m) that were trained to achieve generalization(grokking)?,"Especially models that used [https://arxiv.org/pdf/2405.20233](https://arxiv.org/pdf/2405.20233)   
Because I can't seem to find any.",2024-11-01 03:26:27,13,https://www.reddit.com/r/LocalLLaMA/comments/1gh27a6/are_there_any_models200m_that_were_trained_to/
1gh1g89,Benchmark proposal: explain-xkcd,"Explaining [xkcd](https://xkcd.com/) comics should be a decent challenge for vision-enabled LLMs. A lot of the comics require a synthesis of contextual understanding and prior knowledge to be able to grasp and explain, and there is also something like a ""ground truth"" already available (via [https://www.explainxkcd.com/](https://www.explainxkcd.com/) ). Both the original comic and the explainer website are available under permissive licensing (CC-BY-NC-2.5 and CC-BY-SA-3.0, respectively), so we should be good so long as proper attribution is provided.

We could use an ELO-rating and let users pick their favorite between two explanations. It should be pretty fun for the people who are voting, too.

What does everyone think? I can whip a demo if people are interested in this.",2024-11-01 02:30:37,193,https://www.reddit.com/r/LocalLLaMA/comments/1gh1g89/benchmark_proposal_explainxkcd/
1gh1f0p,Model Suggestion,"I'm tired finding models online and after all testing only got 2 good models. which one you think better for rp and erp (i've 30gb vram)  
\- Mistral Small 22B (09-24) Instuct (Q8) \[Mistral Small template (Latest one)\]

\- Mixtral v0.1 8x7B Instruct (Q4\_K\_M) \[ChatML works alot better on this model.\]

Edit: Mistral Small starts yapping alot. while Mixtral v0.1 8x7B follows character personality alot.",2024-11-01 02:28:00,1,https://www.reddit.com/r/LocalLLaMA/comments/1gh1f0p/model_suggestion/
1gh0mhr,Message from a cop: generative AI presents ZERO catastrophic CBRN risk,"The local llama community is very good at seeing through the fearmongering by large corporates for what it really is, but we need to become more vocal on educating the public on the fundamental falsehood that knowledge itself presents a catastrophic risk in relation to CBRN weapons of mass destruction.

The issue in this domain is not knowledge, but access to materials. If you're not a farmer, try placing an order for a truckload of fertilizer. It can't be done, access to such supplies is under surveillance. This is the basis of modern policing.

So as we tell people that OpenAI/Anthropic want a moat, we should also explain that their starting premise of a catastrophic risk is fundamentally flawed. It's a lie by omission, misrepresenting how modern society works.",2024-11-01 01:24:27,117,https://www.reddit.com/r/LocalLLaMA/comments/1gh0mhr/message_from_a_cop_generative_ai_presents_zero/
1gh0dgd,Frontend Considerations?,"I've been starting to toy around using LLM's in LM Studio for information I have to keep local on my work machine, and it works great (recently also tried RAG in AnythingLLM which is really good too).

LM Studio can serve an API, which is fine, and I intend to run it on another computer with GPU and serve to other computers on my LAN (or across the internet).

However, what frontends do you typically use for chatting? I know LM Studio is typically a backend system with a frontend feature (which is really nice) but i can't see how it would work against an external API (not that I've found at least).

So, what similar frontends (with API integration of course) with good conversations management features exist (I'm on both Mac and Win). 

I have searched, but there seems to be a high cadence of software development and releases in this area so anything new and great is nice to see.

  
Thanks",2024-11-01 01:03:09,4,https://www.reddit.com/r/LocalLLaMA/comments/1gh0dgd/frontend_considerations/
1gh03v4,Closed and open language models by Chat Arena rank,,2024-11-01 00:41:52,218,https://i.redd.it/2m6r4czyu8yd1.png
1ggzj03,What format are you using for your RP/ERP character descriptions?,"Iâ€™ve been exclusively using W++ since the Pygmalion days since I found the older smaller models tended to have an easier time with W++ than a plain text description. I havenâ€™t bothered to change it up but my guess is that current models would be able to handle almost any format.

So, whatâ€™s everyone else using? Anyone found a format that works especially well?",2024-10-31 23:54:05,7,https://www.reddit.com/r/LocalLLaMA/comments/1ggzj03/what_format_are_you_using_for_your_rperp/
